{
  "schemaVersion": 1,
  "packageID": "eu.kanade.tachiyomi.extension.en.drakescans",
  "name": "Drake Scans",
  "version": "1.6.52",
  "contentRating": "safe",
  "iconURL": "https://cdn.jsdelivr.net/gh/keiyoushi/extensions-source@main/src/en/drakescans/res/mipmap-xhdpi/ic_launcher.png",
  "adapter": {
    "engine": "vinetheme",
    "status": "unimplemented",
    "options": {}
  },
  "sources": [
    {
      "id": "7298341958704597260",
      "name": "Drake Scans",
      "language": "en",
      "baseURL": "https://drakecomic.net",
      "mirrorURLs": []
    }
  ]
}
