{
  "schemaVersion": 1,
  "packageID": "eu.kanade.tachiyomi.extension.en.readvagabondmanga",
  "name": "Read Vagabond Manga",
  "version": "1.6.0",
  "contentRating": "safe",
  "iconURL": "https://cdn.jsdelivr.net/gh/keiyoushi/extensions-source@main/src/en/readvagabondmanga/res/mipmap-xhdpi/ic_launcher.png",
  "adapter": {
    "engine": "custom",
    "status": "unimplemented",
    "options": {}
  },
  "sources": [
    {
      "id": "5300358436613908601",
      "name": "Read Vagabond Manga",
      "language": "en",
      "baseURL": "https://readbagabondo.com",
      "mirrorURLs": []
    }
  ]
}
