{
  "schemaVersion": 1,
  "packageID": "eu.kanade.tachiyomi.extension.pt.slimereadunoriginal",
  "name": "SlimeRead (unoriginal)",
  "version": "1.6.1",
  "contentRating": "mixed",
  "iconURL": "https://cdn.jsdelivr.net/gh/keiyoushi/extensions-source@main/src/pt/slimereadunoriginal/res/mipmap-xhdpi/ic_launcher.png",
  "adapter": {
    "engine": "custom",
    "status": "unimplemented",
    "options": {}
  },
  "sources": [
    {
      "id": "4690666610218684539",
      "name": "SlimeRead (unoriginal)",
      "language": "pt-BR",
      "baseURL": "https://slimeread.app",
      "mirrorURLs": []
    }
  ]
}
